iteration,kind,param,value,appraisal,passed,first_failure,decision
0,,,,0.8120696003583808,True,,KEEP
1,overlay,overlay,"{'lam': 20.0, 'signal': 'absorption', 'window': 252, 'scale': 1.0, 'floor': 0.4, 'arm': None, 'limits': {'bear': {0: 1.0, 1: 0.8, 2: 0.5}, 'bull': {0: 1.0, 1: 0.9, 2: 0.8}, 'neutral': {0: 1.0, 1: 0.9, 2: 0.8}}}",0.9107122501714557,True,,KEEP
2,overlay,overlay,"{'lam': 100.0, 'signal': 'absorption', 'window': 252, 'scale': 1.0, 'floor': 0.4, 'arm': None, 'limits': {'bear': {0: 1.0, 1: 0.8, 2: 0.5}, 'bull': {0: 1.0, 1: 0.9, 2: 0.8}, 'neutral': {0: 1.0, 1: 0.9, 2: 0.8}}}",0.6969112626311068,False,budget: CAGR 6.94% vs floor 7.11%,REVERT
3,overlay,overlay,"{'lam': 20.0, 'signal': 'absorption', 'window': 126, 'scale': 1.0, 'floor': 0.4, 'arm': None, 'limits': {'bear': {0: 1.0, 1: 0.8, 2: 0.5}, 'bull': {0: 1.0, 1: 0.9, 2: 0.8}, 'neutral': {0: 1.0, 1: 0.9, 2: 0.8}}}",0.9032663507537055,True,,REVERT
4,overlay,overlay,"{'lam': 20.0, 'signal': 'absorption', 'window': 504, 'scale': 1.0, 'floor': 0.4, 'arm': None, 'limits': {'bear': {0: 1.0, 1: 0.8, 2: 0.5}, 'bull': {0: 1.0, 1: 0.9, 2: 0.8}, 'neutral': {0: 1.0, 1: 0.9, 2: 0.8}}}",0.7217905181036637,False,budget: CAGR 6.98% vs floor 7.11%,REVERT
5,overlay,overlay,"{'lam': 20.0, 'signal': 'turbulence', 'window': 252, 'scale': 1.0, 'floor': 0.4, 'arm': None, 'limits': {'bear': {0: 1.0, 1: 0.8, 2: 0.5}, 'bull': {0: 1.0, 1: 0.9, 2: 0.8}, 'neutral': {0: 1.0, 1: 0.9, 2: 0.8}}}",0.9464250056977235,True,,KEEP
6,overlay,overlay,"{'lam': 100.0, 'signal': 'turbulence', 'window': 252, 'scale': 1.0, 'floor': 0.4, 'arm': None, 'limits': {'bear': {0: 1.0, 1: 0.8, 2: 0.5}, 'bull': {0: 1.0, 1: 0.9, 2: 0.8}, 'neutral': {0: 1.0, 1: 0.9, 2: 0.8}}}",0.7475806511752638,True,,REVERT
7,overlay,overlay,"{'lam': 20.0, 'signal': 'turbulence', 'window': 126, 'scale': 1.0, 'floor': 0.4, 'arm': None, 'limits': {'bear': {0: 1.0, 1: 0.8, 2: 0.5}, 'bull': {0: 1.0, 1: 0.9, 2: 0.8}, 'neutral': {0: 1.0, 1: 0.9, 2: 0.8}}}",0.8812092868764482,True,,REVERT
8,overlay,overlay,"{'lam': 20.0, 'signal': 'turbulence', 'window': 504, 'scale': 1.0, 'floor': 0.4, 'arm': None, 'limits': {'bear': {0: 1.0, 1: 0.8, 2: 0.5}, 'bull': {0: 1.0, 1: 0.9, 2: 0.8}, 'neutral': {0: 1.0, 1: 0.9, 2: 0.8}}}",0.9430783901400983,True,,REVERT
9,overlay,overlay,"{'lam': 20.0, 'signal': 'absorption', 'window': 252, 'scale': 1.0, 'floor': 0.4, 'arm': None, 'limits': {'bear': {0: 1.0, 1: 0.8, 2: 0.5}, 'bull': {0: 1.0, 1: 0.9, 2: 0.8}, 'neutral': {0: 1.0, 1: 0.9, 2: 0.8}}}",0.9107122501714557,True,,REVERT
10,overlay,overlay,"{'lam': 20.0, 'signal': 'turbulence', 'window': 252, 'scale': 0.9, 'floor': 0.4, 'arm': None, 'limits': {'bear': {0: 1.0, 1: 0.8, 2: 0.5}, 'bull': {0: 1.0, 1: 0.9, 2: 0.8}, 'neutral': {0: 1.0, 1: 0.9, 2: 0.8}}}",0.9464140704057729,True,,REVERT
11,overlay,overlay,"{'lam': 20.0, 'signal': 'turbulence', 'window': 252, 'scale': 1.1, 'floor': 0.4, 'arm': None, 'limits': {'bear': {0: 1.0, 1: 0.8, 2: 0.5}, 'bull': {0: 1.0, 1: 0.9, 2: 0.8}, 'neutral': {0: 1.0, 1: 0.9, 2: 0.8}}}",0.9350328767183134,True,,REVERT
12,overlay,overlay,"{'lam': 20.0, 'signal': 'turbulence', 'window': 252, 'scale': 1.2, 'floor': 0.4, 'arm': None, 'limits': {'bear': {0: 1.0, 1: 0.8, 2: 0.5}, 'bull': {0: 1.0, 1: 0.9, 2: 0.8}, 'neutral': {0: 1.0, 1: 0.9, 2: 0.8}}}",0.9388613789433435,True,,REVERT
13,overlay,overlay,"{'lam': 20.0, 'signal': 'turbulence', 'window': 252, 'scale': 1.3, 'floor': 0.4, 'arm': None, 'limits': {'bear': {0: 1.0, 1: 0.8, 2: 0.5}, 'bull': {0: 1.0, 1: 0.9, 2: 0.8}, 'neutral': {0: 1.0, 1: 0.9, 2: 0.8}}}",0.9369928892979177,True,,REVERT
14,overlay,overlay,"{'lam': 20.0, 'signal': 'turbulence', 'window': 252, 'scale': 1.0, 'floor': 0.5, 'arm': None, 'limits': {'bear': {0: 1.0, 1: 0.8, 2: 0.5}, 'bull': {0: 1.0, 1: 0.9, 2: 0.8}, 'neutral': {0: 1.0, 1: 0.9, 2: 0.8}}}",0.9464250056977235,True,,REVERT
15,overlay,overlay,"{'lam': 20.0, 'signal': 'turbulence', 'window': 252, 'scale': 1.0, 'floor': 0.3, 'arm': None, 'limits': {'bear': {0: 1.0, 1: 0.8, 2: 0.5}, 'bull': {0: 1.0, 1: 0.9, 2: 0.8}, 'neutral': {0: 1.0, 1: 0.9, 2: 0.8}}}",0.9464250056977235,True,,REVERT
16,overlay,overlay,"{'lam': 20.0, 'signal': 'turbulence', 'window': 252, 'scale': 1.0, 'floor': 0.4, 'arm': -0.02, 'limits': {'bear': {0: 1.0, 1: 0.8, 2: 0.5}, 'bull': {0: 1.0, 1: 0.9, 2: 0.8}, 'neutral': {0: 1.0, 1: 0.9, 2: 0.8}}}",1.0807368085473215,True,,KEEP
17,overlay,overlay,"{'lam': 100.0, 'signal': 'turbulence', 'window': 252, 'scale': 1.0, 'floor': 0.4, 'arm': -0.02, 'limits': {'bear': {0: 1.0, 1: 0.8, 2: 0.5}, 'bull': {0: 1.0, 1: 0.9, 2: 0.8}, 'neutral': {0: 1.0, 1: 0.9, 2: 0.8}}}",0.8723400095555743,True,,REVERT
18,overlay,overlay,"{'lam': 20.0, 'signal': 'turbulence', 'window': 126, 'scale': 1.0, 'floor': 0.4, 'arm': -0.02, 'limits': {'bear': {0: 1.0, 1: 0.8, 2: 0.5}, 'bull': {0: 1.0, 1: 0.9, 2: 0.8}, 'neutral': {0: 1.0, 1: 0.9, 2: 0.8}}}",0.9364364023763364,True,,REVERT
19,overlay,overlay,"{'lam': 20.0, 'signal': 'turbulence', 'window': 504, 'scale': 1.0, 'floor': 0.4, 'arm': -0.02, 'limits': {'bear': {0: 1.0, 1: 0.8, 2: 0.5}, 'bull': {0: 1.0, 1: 0.9, 2: 0.8}, 'neutral': {0: 1.0, 1: 0.9, 2: 0.8}}}",1.0756782304814771,True,,REVERT
20,overlay,overlay,"{'lam': 20.0, 'signal': 'absorption', 'window': 252, 'scale': 1.0, 'floor': 0.4, 'arm': -0.02, 'limits': {'bear': {0: 1.0, 1: 0.8, 2: 0.5}, 'bull': {0: 1.0, 1: 0.9, 2: 0.8}, 'neutral': {0: 1.0, 1: 0.9, 2: 0.8}}}",1.056233498762897,True,,REVERT
21,overlay,overlay,"{'lam': 20.0, 'signal': 'turbulence', 'window': 252, 'scale': 0.9, 'floor': 0.4, 'arm': -0.02, 'limits': {'bear': {0: 1.0, 1: 0.8, 2: 0.5}, 'bull': {0: 1.0, 1: 0.9, 2: 0.8}, 'neutral': {0: 1.0, 1: 0.9, 2: 0.8}}}",1.1203581270516634,True,,KEEP
22,overlay,overlay,"{'lam': 100.0, 'signal': 'turbulence', 'window': 252, 'scale': 0.9, 'floor': 0.4, 'arm': -0.02, 'limits': {'bear': {0: 1.0, 1: 0.8, 2: 0.5}, 'bull': {0: 1.0, 1: 0.9, 2: 0.8}, 'neutral': {0: 1.0, 1: 0.9, 2: 0.8}}}",0.9106769430706071,True,,REVERT
23,overlay,overlay,"{'lam': 20.0, 'signal': 'turbulence', 'window': 126, 'scale': 0.9, 'floor': 0.4, 'arm': -0.02, 'limits': {'bear': {0: 1.0, 1: 0.8, 2: 0.5}, 'bull': {0: 1.0, 1: 0.9, 2: 0.8}, 'neutral': {0: 1.0, 1: 0.9, 2: 0.8}}}",0.9737578444095589,True,,REVERT
24,overlay,overlay,"{'lam': 20.0, 'signal': 'turbulence', 'window': 504, 'scale': 0.9, 'floor': 0.4, 'arm': -0.02, 'limits': {'bear': {0: 1.0, 1: 0.8, 2: 0.5}, 'bull': {0: 1.0, 1: 0.9, 2: 0.8}, 'neutral': {0: 1.0, 1: 0.9, 2: 0.8}}}",1.1154226112900405,True,,REVERT
25,overlay,overlay,"{'lam': 20.0, 'signal': 'absorption', 'window': 252, 'scale': 0.9, 'floor': 0.4, 'arm': -0.02, 'limits': {'bear': {0: 1.0, 1: 0.8, 2: 0.5}, 'bull': {0: 1.0, 1: 0.9, 2: 0.8}, 'neutral': {0: 1.0, 1: 0.9, 2: 0.8}}}",1.0982482414157089,True,,REVERT
26,overlay,overlay,"{'lam': 20.0, 'signal': 'turbulence', 'window': 252, 'scale': 1.1, 'floor': 0.4, 'arm': -0.02, 'limits': {'bear': {0: 1.0, 1: 0.8, 2: 0.5}, 'bull': {0: 1.0, 1: 0.9, 2: 0.8}, 'neutral': {0: 1.0, 1: 0.9, 2: 0.8}}}",1.0297751731532112,True,,REVERT
27,overlay,overlay,"{'lam': 20.0, 'signal': 'turbulence', 'window': 252, 'scale': 1.2, 'floor': 0.4, 'arm': -0.02, 'limits': {'bear': {0: 1.0, 1: 0.8, 2: 0.5}, 'bull': {0: 1.0, 1: 0.9, 2: 0.8}, 'neutral': {0: 1.0, 1: 0.9, 2: 0.8}}}",1.0051146193275948,True,,REVERT
28,overlay,overlay,"{'lam': 20.0, 'signal': 'turbulence', 'window': 252, 'scale': 1.3, 'floor': 0.4, 'arm': -0.02, 'limits': {'bear': {0: 1.0, 1: 0.8, 2: 0.5}, 'bull': {0: 1.0, 1: 0.9, 2: 0.8}, 'neutral': {0: 1.0, 1: 0.9, 2: 0.8}}}",0.9857711427051526,True,,REVERT
29,overlay,overlay,"{'lam': 20.0, 'signal': 'turbulence', 'window': 252, 'scale': 0.9, 'floor': 0.5, 'arm': -0.02, 'limits': {'bear': {0: 1.0, 1: 0.8, 2: 0.5}, 'bull': {0: 1.0, 1: 0.9, 2: 0.8}, 'neutral': {0: 1.0, 1: 0.9, 2: 0.8}}}",1.0952359141684622,True,,REVERT
30,overlay,overlay,"{'lam': 20.0, 'signal': 'turbulence', 'window': 252, 'scale': 0.9, 'floor': 0.3, 'arm': -0.02, 'limits': {'bear': {0: 1.0, 1: 0.8, 2: 0.5}, 'bull': {0: 1.0, 1: 0.9, 2: 0.8}, 'neutral': {0: 1.0, 1: 0.9, 2: 0.8}}}",1.1203581270516634,True,,REVERT
31,overlay,overlay,"{'lam': 20.0, 'signal': 'turbulence', 'window': 252, 'scale': 0.9, 'floor': 0.4, 'arm': None, 'limits': {'bear': {0: 1.0, 1: 0.8, 2: 0.5}, 'bull': {0: 1.0, 1: 0.9, 2: 0.8}, 'neutral': {0: 1.0, 1: 0.9, 2: 0.8}}}",0.9464140704057729,True,,REVERT
32,overlay,overlay,"{'lam': 20.0, 'signal': 'turbulence', 'window': 252, 'scale': 0.9, 'floor': 0.4, 'arm': -0.03, 'limits': {'bear': {0: 1.0, 1: 0.8, 2: 0.5}, 'bull': {0: 1.0, 1: 0.9, 2: 0.8}, 'neutral': {0: 1.0, 1: 0.9, 2: 0.8}}}",1.1564782022665763,True,,KEEP
33,overlay,overlay,"{'lam': 100.0, 'signal': 'turbulence', 'window': 252, 'scale': 0.9, 'floor': 0.4, 'arm': -0.03, 'limits': {'bear': {0: 1.0, 1: 0.8, 2: 0.5}, 'bull': {0: 1.0, 1: 0.9, 2: 0.8}, 'neutral': {0: 1.0, 1: 0.9, 2: 0.8}}}",0.9496319830961817,True,,REVERT
34,overlay,overlay,"{'lam': 20.0, 'signal': 'turbulence', 'window': 126, 'scale': 0.9, 'floor': 0.4, 'arm': -0.03, 'limits': {'bear': {0: 1.0, 1: 0.8, 2: 0.5}, 'bull': {0: 1.0, 1: 0.9, 2: 0.8}, 'neutral': {0: 1.0, 1: 0.9, 2: 0.8}}}",1.0147700362827066,True,,REVERT
35,overlay,overlay,"{'lam': 20.0, 'signal': 'turbulence', 'window': 504, 'scale': 0.9, 'floor': 0.4, 'arm': -0.03, 'limits': {'bear': {0: 1.0, 1: 0.8, 2: 0.5}, 'bull': {0: 1.0, 1: 0.9, 2: 0.8}, 'neutral': {0: 1.0, 1: 0.9, 2: 0.8}}}",1.1475046013317798,True,,REVERT
36,overlay,overlay,"{'lam': 20.0, 'signal': 'absorption', 'window': 252, 'scale': 0.9, 'floor': 0.4, 'arm': -0.03, 'limits': {'bear': {0: 1.0, 1: 0.8, 2: 0.5}, 'bull': {0: 1.0, 1: 0.9, 2: 0.8}, 'neutral': {0: 1.0, 1: 0.9, 2: 0.8}}}",1.174619160355328,True,,KEEP
37,overlay,overlay,"{'lam': 100.0, 'signal': 'absorption', 'window': 252, 'scale': 0.9, 'floor': 0.4, 'arm': -0.03, 'limits': {'bear': {0: 1.0, 1: 0.8, 2: 0.5}, 'bull': {0: 1.0, 1: 0.9, 2: 0.8}, 'neutral': {0: 1.0, 1: 0.9, 2: 0.8}}}",0.9554207821154084,True,,REVERT
38,overlay,overlay,"{'lam': 20.0, 'signal': 'absorption', 'window': 126, 'scale': 0.9, 'floor': 0.4, 'arm': -0.03, 'limits': {'bear': {0: 1.0, 1: 0.8, 2: 0.5}, 'bull': {0: 1.0, 1: 0.9, 2: 0.8}, 'neutral': {0: 1.0, 1: 0.9, 2: 0.8}}}",1.1754682642310814,True,,KEEP
39,overlay,overlay,"{'lam': 100.0, 'signal': 'absorption', 'window': 126, 'scale': 0.9, 'floor': 0.4, 'arm': -0.03, 'limits': {'bear': {0: 1.0, 1: 0.8, 2: 0.5}, 'bull': {0: 1.0, 1: 0.9, 2: 0.8}, 'neutral': {0: 1.0, 1: 0.9, 2: 0.8}}}",0.9561368216592773,True,,REVERT
40,overlay,overlay,"{'lam': 20.0, 'signal': 'absorption', 'window': 504, 'scale': 0.9, 'floor': 0.4, 'arm': -0.03, 'limits': {'bear': {0: 1.0, 1: 0.8, 2: 0.5}, 'bull': {0: 1.0, 1: 0.9, 2: 0.8}, 'neutral': {0: 1.0, 1: 0.9, 2: 0.8}}}",1.010746443610523,True,,REVERT
41,overlay,overlay,"{'lam': 20.0, 'signal': 'turbulence', 'window': 126, 'scale': 0.9, 'floor': 0.4, 'arm': -0.03, 'limits': {'bear': {0: 1.0, 1: 0.8, 2: 0.5}, 'bull': {0: 1.0, 1: 0.9, 2: 0.8}, 'neutral': {0: 1.0, 1: 0.9, 2: 0.8}}}",1.0147700362827066,True,,REVERT
42,overlay,overlay,"{'lam': 20.0, 'signal': 'absorption', 'window': 126, 'scale': 1.1, 'floor': 0.4, 'arm': -0.03, 'limits': {'bear': {0: 1.0, 1: 0.8, 2: 0.5}, 'bull': {0: 1.0, 1: 0.9, 2: 0.8}, 'neutral': {0: 1.0, 1: 0.9, 2: 0.8}}}",1.066285959932694,True,,REVERT
43,overlay,overlay,"{'lam': 20.0, 'signal': 'absorption', 'window': 126, 'scale': 1.2, 'floor': 0.4, 'arm': -0.03, 'limits': {'bear': {0: 1.0, 1: 0.8, 2: 0.5}, 'bull': {0: 1.0, 1: 0.9, 2: 0.8}, 'neutral': {0: 1.0, 1: 0.9, 2: 0.8}}}",1.01756784894328,True,,REVERT
44,overlay,overlay,"{'lam': 20.0, 'signal': 'absorption', 'window': 126, 'scale': 1.3, 'floor': 0.4, 'arm': -0.03, 'limits': {'bear': {0: 1.0, 1: 0.8, 2: 0.5}, 'bull': {0: 1.0, 1: 0.9, 2: 0.8}, 'neutral': {0: 1.0, 1: 0.9, 2: 0.8}}}",0.9860034216061011,True,,REVERT
45,overlay,overlay,"{'lam': 20.0, 'signal': 'absorption', 'window': 126, 'scale': 0.9, 'floor': 0.5, 'arm': -0.03, 'limits': {'bear': {0: 1.0, 1: 0.8, 2: 0.5}, 'bull': {0: 1.0, 1: 0.9, 2: 0.8}, 'neutral': {0: 1.0, 1: 0.9, 2: 0.8}}}",1.1487070049959334,True,,REVERT
46,overlay,overlay,"{'lam': 20.0, 'signal': 'absorption', 'window': 126, 'scale': 0.9, 'floor': 0.3, 'arm': -0.03, 'limits': {'bear': {0: 1.0, 1: 0.8, 2: 0.5}, 'bull': {0: 1.0, 1: 0.9, 2: 0.8}, 'neutral': {0: 1.0, 1: 0.9, 2: 0.8}}}",1.1754682642310814,True,,REVERT
47,overlay,overlay,"{'lam': 20.0, 'signal': 'absorption', 'window': 126, 'scale': 0.9, 'floor': 0.4, 'arm': None, 'limits': {'bear': {0: 1.0, 1: 0.8, 2: 0.5}, 'bull': {0: 1.0, 1: 0.9, 2: 0.8}, 'neutral': {0: 1.0, 1: 0.9, 2: 0.8}}}",0.9033145051517298,False,budget: CAGR 6.73% vs floor 7.11%,REVERT
48,overlay,overlay,"{'lam': 20.0, 'signal': 'absorption', 'window': 126, 'scale': 0.9, 'floor': 0.4, 'arm': -0.02, 'limits': {'bear': {0: 1.0, 1: 0.8, 2: 0.5}, 'bull': {0: 1.0, 1: 0.9, 2: 0.8}, 'neutral': {0: 1.0, 1: 0.9, 2: 0.8}}}",1.09631295218266,True,,REVERT
49,overlay,overlay,"{'lam': 20.0, 'signal': 'absorption', 'window': 126, 'scale': 0.9, 'floor': 0.4, 'arm': -0.04, 'limits': {'bear': {0: 1.0, 1: 0.8, 2: 0.5}, 'bull': {0: 1.0, 1: 0.9, 2: 0.8}, 'neutral': {0: 1.0, 1: 0.9, 2: 0.8}}}",0.9961559740955079,True,,REVERT
50,overlay,overlay,"{'lam': 20.0, 'signal': 'absorption', 'window': 126, 'scale': 0.9, 'floor': 0.4, 'arm': -0.05, 'limits': {'bear': {0: 1.0, 1: 0.8, 2: 0.5}, 'bull': {0: 1.0, 1: 0.9, 2: 0.8}, 'neutral': {0: 1.0, 1: 0.9, 2: 0.8}}}",1.0002278987710291,True,,REVERT
